{
  "schema_version": 1,
  "sequence": 0,
  "previous_record_hash": null,
  "actor": "windows_bootstrap",
  "transition_id": "create_installer_entry",
  "record_type": "action_intent",
  "precondition_hash": "1111111111111111111111111111111111111111111111111111111111111111",
  "postcondition_hash": null,
  "plan_hash": "c558b122396cde57c2ec9937a9d599ed4176867d8cef8ec3d762d3cf3c3bcd56",
  "created_objects": []
}
