[
  {
    "schema_version": 1,
    "sequence": 0,
    "previous_record_hash": null,
    "actor": "windows_bootstrap",
    "transition_id": "create_installer_entry",
    "record_type": "action_intent",
    "precondition_hash": "1111111111111111111111111111111111111111111111111111111111111111",
    "postcondition_hash": null,
    "plan_hash": "be5f11b553a3d3e49271a24754c5782530dfa2c81bbdb3f788f0c951b019ae07",
    "created_objects": []
  },
  {
    "schema_version": 1,
    "sequence": 1,
    "previous_record_hash": "b6c99bd645a7ec792c4ee47cf9380261cf2d8c6e145c98e868c8c30c88d6292c",
    "actor": "windows_bootstrap",
    "transition_id": "create_installer_entry",
    "record_type": "action_committed",
    "precondition_hash": "1111111111111111111111111111111111111111111111111111111111111111",
    "postcondition_hash": "2222222222222222222222222222222222222222222222222222222222222222",
    "plan_hash": "be5f11b553a3d3e49271a24754c5782530dfa2c81bbdb3f788f0c951b019ae07",
    "created_objects": [
      {
        "kind": "boot_entry",
        "stable_id": "uefi:Boot0007"
      }
    ]
  },
  {
    "schema_version": 1,
    "sequence": 2,
    "previous_record_hash": "86cec483ad9df7cfc39814b2052866ed1550039ebd4c16c067ccca356536a710",
    "actor": "windows_bootstrap",
    "transition_id": "create_installer_entry",
    "record_type": "state_advanced",
    "precondition_hash": "2222222222222222222222222222222222222222222222222222222222222222",
    "postcondition_hash": "44bfe9d9b95d5b3f53fa40dfe47a9011f59744a61072e4a7e42cb3c6b17ff397",
    "plan_hash": "be5f11b553a3d3e49271a24754c5782530dfa2c81bbdb3f788f0c951b019ae07",
    "created_objects": []
  },
  {
    "schema_version": 1,
    "sequence": 3,
    "previous_record_hash": "5c09e0c0854f039a8f18b5390ebbe7b647f7738b61bbcc6217426fd640231aaf",
    "actor": "windows_bootstrap",
    "transition_id": "reboot_to_installer",
    "record_type": "action_intent",
    "precondition_hash": "3333333333333333333333333333333333333333333333333333333333333333",
    "postcondition_hash": null,
    "plan_hash": "be5f11b553a3d3e49271a24754c5782530dfa2c81bbdb3f788f0c951b019ae07",
    "created_objects": []
  },
  {
    "schema_version": 1,
    "sequence": 4,
    "previous_record_hash": "c143675711948ff6d5693346a21e9ce256d653e5714e5bb6d8f52408a37130e6",
    "actor": "windows_bootstrap",
    "transition_id": "reboot_to_installer",
    "record_type": "action_committed",
    "precondition_hash": "3333333333333333333333333333333333333333333333333333333333333333",
    "postcondition_hash": "4444444444444444444444444444444444444444444444444444444444444444",
    "plan_hash": "be5f11b553a3d3e49271a24754c5782530dfa2c81bbdb3f788f0c951b019ae07",
    "created_objects": []
  },
  {
    "schema_version": 1,
    "sequence": 5,
    "previous_record_hash": "034c601e8020c4cf3974c7cde3e8744ddfcf9fb8ecb9007f3c98ff4117ab7211",
    "actor": "windows_bootstrap",
    "transition_id": "reboot_to_installer",
    "record_type": "state_advanced",
    "precondition_hash": "4444444444444444444444444444444444444444444444444444444444444444",
    "postcondition_hash": "fb6d30347943c5a8840ec21cd8dc3b30951a091259d721b79e6037c23af8989e",
    "plan_hash": "be5f11b553a3d3e49271a24754c5782530dfa2c81bbdb3f788f0c951b019ae07",
    "created_objects": []
  }
]
